{"artifact_type":"readonly-agent-evaluation-manifest","boundary":"Questions and structural gold are frozen before inference. This cohort measures tool choice, effective parameters, evidence citation, policy refusal, and cost; it does not certify prose semantics or human usability.","budget":{"context_window":8192,"max_model_calls":4,"max_observation_chars":20000,"max_output_tokens_per_call":256,"max_seconds":120.0,"max_steps":4,"max_tool_calls":3,"max_total_tokens":6000},"cases":[{"bundle_sha256":"68134b833e26e93825a6cd7d8eaf4faf9446f3dfa3ccc609ffcc0071a3622ff2","case_id":"ambiguous-project-boundary","category":"complex-project-explanation","expected":{"first_tool":"project_query_facts","forbidden_tools":["project_verify_report","knowledge_retrieve_reviewed"],"gold_fact_ids":["d1a0e381b88bb63f67273a8fb5528d7f3e583c1a57c55764941597c5a513559a","235515e6d6449bb03215f48cffb97603a1e398e005de0b0e53e65c59b6b8ed70","7e36d8cc4e1b54b3088ae34b249010c5e13d420d7d5f181b1f20e05b1878b6a7","a8dffe6141fe22ea8a27474d6193fff6e1999d7ed0b15a27178cb799f5e19afa"],"knowledge_document_ids":[],"max_model_calls":2,"max_tool_calls":1,"max_total_tokens":3000,"reason_prefix":"completed_with_unassessed_model_summary","required_evidence_tools":["project_query_facts"],"required_tools":["project_query_facts"],"status":"passed"},"goal":"只查询项目报告并解释 impact 与 policy.TASK_REF 两项为何 blocked：分别给出 status/reason，并明确这些字段能证明什么、不能证明什么；不要检索资料。","report":"output/p28-validation/installed-final/evidence/delivery/projects/ambiguous/bundle/project-report.json","report_sha256":"2b4e6bcd7f353bdfb8ebfccb7297674c1d5ab97b2ce618f7d4fcb1fb5e29eeb0"},{"bundle_sha256":"68134b833e26e93825a6cd7d8eaf4faf9446f3dfa3ccc609ffcc0071a3622ff2","case_id":"official-validation-boundary","category":"official-knowledge-applicability","expected":{"first_tool":"knowledge_retrieve_reviewed","forbidden_tools":["project_verify_report","project_query_facts"],"gold_fact_ids":[],"knowledge_document_ids":[101,102],"max_model_calls":2,"max_tool_calls":1,"max_total_tokens":3500,"reason_prefix":"completed_with_unassessed_model_summary","required_evidence_tools":["knowledge_retrieve_reviewed"],"required_tools":["knowledge_retrieve_reviewed"],"status":"passed"},"goal":"只检索已审核官方资料：dvcfg-b project validate 检查什么？缺少实际命令、DaVinci project、BSW package 和输出时，能否声称本项目已通过或失败于 DaVinci 校验？不要查询项目事实。","report":"output/p28-validation/installed-final/evidence/delivery/projects/ambiguous/bundle/project-report.json","report_sha256":"2b4e6bcd7f353bdfb8ebfccb7297674c1d5ab97b2ce618f7d4fcb1fb5e29eeb0"},{"bundle_sha256":"68134b833e26e93825a6cd7d8eaf4faf9446f3dfa3ccc609ffcc0071a3622ff2","case_id":"package-mismatch-causality","category":"mixed-causal-applicability","expected":{"first_tool":"project_query_facts","forbidden_tools":["project_verify_report"],"gold_fact_ids":["d1a0e381b88bb63f67273a8fb5528d7f3e583c1a57c55764941597c5a513559a","235515e6d6449bb03215f48cffb97603a1e398e005de0b0e53e65c59b6b8ed70","7e36d8cc4e1b54b3088ae34b249010c5e13d420d7d5f181b1f20e05b1878b6a7","a8dffe6141fe22ea8a27474d6193fff6e1999d7ed0b15a27178cb799f5e19afa"],"knowledge_document_ids":[101,102],"max_model_calls":3,"max_tool_calls":2,"max_total_tokens":5500,"reason_prefix":"completed_with_unassessed_model_summary","required_evidence_tools":["project_query_facts","knowledge_retrieve_reviewed"],"required_tools":["project_query_facts","knowledge_retrieve_reviewed"],"status":"passed"},"goal":"先查询 impact 与 policy.TASK_REF 的 status/reason，再检索已审核官方资料。判断本报告能否证明 DaVinci BSW Package identity mismatch 是根因；列出结论边界和下一步应核对的证据，不要声称已运行 DaVinci。","report":"output/p28-validation/installed-final/evidence/delivery/projects/ambiguous/bundle/project-report.json","report_sha256":"2b4e6bcd7f353bdfb8ebfccb7297674c1d5ab97b2ce618f7d4fcb1fb5e29eeb0"},{"bundle_sha256":"68134b833e26e93825a6cd7d8eaf4faf9446f3dfa3ccc609ffcc0071a3622ff2","case_id":"bounded-triage-order","category":"mixed-recommendation-boundary","expected":{"first_tool":"project_query_facts","forbidden_tools":["project_verify_report"],"gold_fact_ids":["d1a0e381b88bb63f67273a8fb5528d7f3e583c1a57c55764941597c5a513559a","235515e6d6449bb03215f48cffb97603a1e398e005de0b0e53e65c59b6b8ed70","7e36d8cc4e1b54b3088ae34b249010c5e13d420d7d5f181b1f20e05b1878b6a7","a8dffe6141fe22ea8a27474d6193fff6e1999d7ed0b15a27178cb799f5e19afa"],"knowledge_document_ids":[101,102],"max_model_calls":3,"max_tool_calls":2,"max_total_tokens":5500,"reason_prefix":"completed_with_unassessed_model_summary","required_evidence_tools":["project_query_facts","knowledge_retrieve_reviewed"],"required_tools":["project_query_facts","knowledge_retrieve_reviewed"],"status":"passed"},"goal":"先查询 policy.TASK_REF 与 impact 的 status/reason，再检索已审核官方资料，给出区分 ambiguous_target、snapshots_not_comparable 与 DaVinci BSW Package identity mismatch 的只读排查顺序；不要执行命令，也不要把建议写成已经验证的结论。","report":"output/p28-validation/installed-final/evidence/delivery/projects/ambiguous/bundle/project-report.json","report_sha256":"2b4e6bcd7f353bdfb8ebfccb7297674c1d5ab97b2ce618f7d4fcb1fb5e29eeb0"}],"evaluation_id":"p30-agent-explanation-review-v1","formation":"Four complex explanation and official-knowledge applicability questions were written against the previously unused ambiguous project report after the read-only runtime and human-review protocol were finalized, and before any target-model inference on this cohort. Structural expectations are maintainer-authored and do not pre-judge prose quality.","implementation_sha256":"8859757929a2a3564748737d823530cb4bb76049fdd1226df32f6a27b6b717b9","knowledge_policy":{"path":"examples/knowledge/p30-vector-official-policy.json","policy_id":"b2a213dad56251d4f948112c9016c80eea4c7cfa26ac5392502fa79290fdb7b8","sha256":"9d004afd3cf54aafb4aacc56558dfbf400a2c7219f77628be0a4fae1f9751021"},"manifest_id":"c99acf880ff7085ffb0f5821e8b0867415d91506df3a4aa8efb422ed13b95286","model":{"digest":"324d162be6ca5629ae4517c8710434d0bd2d665bc94dbad46e9af8fbf8a2f0df","name":"qwen3.5:2b"},"schema_version":"readonly-agent-evaluation-manifest-0.1","spec_sha256":"10e1743847f758cdfdb33e0a17d08e741675c0fca4f47c0343dd6fb16027fd95","split":"held-out"}
